{
  "trajectoryFormatVersion": "trajectory.v1",
  "turnId": "turn-golden-001",
  "subjectId": "learner-a",
  "deviceId": "edge-dev1",
  "sessionId": "sess-golden-001",
  "capturedAt": "001700000000100:000002:edge-dev1",
  "locality": "on-device",
  "consentRecordId": "consent-traj-001",
  "stages": [
    {
      "stage": "perceive",
      "status": "ok",
      "chunkIndex": 0
    },
    {
      "stage": "reason",
      "status": "ok",
      "chunkIndex": 0
    },
    {
      "stage": "act",
      "status": "ok",
      "chunkIndex": 0,
      "opCode": "tool.invoke"
    }
  ],
  "toolCalls": [
    {
      "callId": "call-1",
      "toolName": "lookup_concept",
      "argsHash": "sha256:argsdeadbeef01",
      "argsByteLength": 48,
      "status": "ok",
      "resultHash": "sha256:resultdeadbeef01",
      "resultByteLength": 32
    }
  ],
  "outcomes": {
    "status": "completed",
    "terminalStage": "act"
  },
  "modelId": "slm-edge-v1",
  "promptHash": "sha256:prompthashgolden01",
  "responseHash": "sha256:responsehashgolden01",
  "promptByteLength": 256,
  "responseByteLength": 128
}
